{
  "aggregate_id": "4bf974d9-e535-5031-8e5b-b1e7d75d88cf",
  "aggregate_type": "episode",
  "causation_id": "71a6114d-40a2-52ab-b5c8-4fcc2d9cde8c",
  "correlation_id": "49ff935c-5a11-5b28-9699-1d222aa8d2e8",
  "event_id": "96d55d7a-e83b-5d68-8c91-5a3e46ab4731",
  "event_type": "episode.state_changed",
  "occurred_at": "2026-10-20T00:00:00Z",
  "payload": {
    "from": "ASSEMBLING",
    "to": "AI_REVIEW"
  },
  "schema_version": "1.0",
  "sequence": 4
}
